{"artifact":"archbird-source-manifest","files":[{"bytes":0,"language":"c","layer":"core","path":"src/empty.c","roles":["source"],"sha256":"e3b0c44298fc1c149afbf4c8996fb92427ae41e4649b934ca495991b7852b855"}],"producer":{"implementation_sha256":"1111111111111111111111111111111111111111111111111111111111111111","name":"fuzz-host","version":"1"},"project":"fuzz","schema_version":1}
